{
  "$schema": "https://json-schema.org/draft/2020-12/schema",
  "$id": "https://example.invalid/package-spec-language/spec.schema.json",
  "title": "Specification record",
  "type": "object",
  "required": ["kind", "id", "version"],
  "properties": {
    "kind": { "const": "specification" },
    "id": { "$ref": "common.schema.json#/$defs/nonEmptyString" },
    "version": { "$ref": "common.schema.json#/$defs/nonEmptyString" },
    "imports": {
      "type": "array",
      "items": { "$ref": "common.schema.json#/$defs/specificationReference" }
    },
    "carriers": {
      "type": "array",
      "items": { "$ref": "#/$defs/carrierDeclaration" }
    },
    "operations": {
      "type": "array",
      "items": { "$ref": "#/$defs/operationDeclaration" }
    },
    "observations": {
      "type": "array",
      "items": { "$ref": "#/$defs/operationDeclaration" }
    },
    "derivedObservations": {
      "type": "array",
      "items": { "$ref": "#/$defs/derivedObservationDeclaration" }
    },
    "equivalences": {
      "type": "array",
      "items": { "$ref": "#/$defs/equivalenceDeclaration" }
    },
    "laws": {
      "type": "array",
      "items": { "$ref": "#/$defs/lawDeclaration" }
    },
    "protocols": {
      "type": "array",
      "items": { "$ref": "#/$defs/protocolDeclaration" }
    },
    "numericalKernels": {
      "type": "array",
      "items": { "$ref": "#/$defs/numericalKernelDeclaration" }
    },
    "effects": { "$ref": "#/$defs/effectContract" },
    "resources": {
      "type": "array",
      "items": { "$ref": "#/$defs/resourceDeclaration" }
    },
    "performancePropositions": {
      "type": "array",
      "items": { "$ref": "#/$defs/performancePropositionDeclaration" }
    }
  },
  "additionalProperties": false,
  "anyOf": [
    { "required": ["carriers"] },
    { "required": ["operations"] },
    { "required": ["observations"] },
    { "required": ["derivedObservations"] },
    { "required": ["equivalences"] },
    { "required": ["laws"] },
    { "required": ["protocols"] },
    { "required": ["numericalKernels"] },
    { "required": ["effects"] },
    { "required": ["resources"] },
    { "required": ["performancePropositions"] }
  ],
  "$defs": {
    "carrierDeclaration": {
      "type": "object",
      "required": ["id"],
      "properties": {
        "id": { "$ref": "common.schema.json#/$defs/localDeclarationId" },
        "description": { "$ref": "common.schema.json#/$defs/nonEmptyString" }
      },
      "additionalProperties": false
    },
    "operationDeclaration": {
      "type": "object",
      "required": ["id", "signature"],
      "properties": {
        "id": { "$ref": "common.schema.json#/$defs/localDeclarationId" },
        "signature": { "$ref": "common.schema.json#/$defs/nonEmptyString" }
      },
      "additionalProperties": false
    },
    "derivedObservationDeclaration": {
      "type": "object",
      "required": ["id", "definition"],
      "properties": {
        "id": { "$ref": "common.schema.json#/$defs/localDeclarationId" },
        "definition": { "$ref": "common.schema.json#/$defs/nonEmptyString" }
      },
      "additionalProperties": false
    },
    "equivalenceDeclaration": {
      "type": "object",
      "required": ["id", "carrier", "definition"],
      "properties": {
        "id": { "$ref": "common.schema.json#/$defs/localDeclarationId" },
        "carrier": { "$ref": "common.schema.json#/$defs/localDeclarationId" },
        "definition": { "$ref": "common.schema.json#/$defs/nonEmptyString" }
      },
      "additionalProperties": false
    },
    "lawDeclaration": {
      "type": "object",
      "required": ["id", "statement"],
      "properties": {
        "id": { "$ref": "common.schema.json#/$defs/localDeclarationId" },
        "statement": { "$ref": "common.schema.json#/$defs/nonEmptyString" }
      },
      "additionalProperties": false
    },
    "protocolDeclaration": {
      "type": "object",
      "required": [
        "id", "kind", "states", "initialState", "terminalStates",
        "inputs", "outputs", "transitions", "identityObservation"
      ],
      "properties": {
        "id": { "$ref": "common.schema.json#/$defs/localDeclarationId" },
        "kind": { "const": "finite-labelled-transition-system-v1" },
        "states": {
          "type": "array",
          "items": { "$ref": "common.schema.json#/$defs/localDeclarationId" },
          "minItems": 1,
          "uniqueItems": true
        },
        "initialState": { "$ref": "common.schema.json#/$defs/localDeclarationId" },
        "terminalStates": {
          "type": "array",
          "items": { "$ref": "common.schema.json#/$defs/localDeclarationId" },
          "minItems": 1,
          "uniqueItems": true
        },
        "inputs": {
          "type": "array",
          "items": { "$ref": "common.schema.json#/$defs/localDeclarationId" },
          "minItems": 1,
          "uniqueItems": true
        },
        "outputs": {
          "type": "array",
          "items": { "$ref": "common.schema.json#/$defs/localDeclarationId" },
          "minItems": 1,
          "uniqueItems": true
        },
        "transitions": {
          "type": "array",
          "items": { "$ref": "#/$defs/protocolTransition" },
          "minItems": 1
        },
        "identityObservation": {
          "$ref": "common.schema.json#/$defs/nonEmptyString"
        }
      },
      "additionalProperties": false
    },
    "protocolTransition": {
      "type": "object",
      "required": ["from", "input", "output", "to"],
      "properties": {
        "from": { "$ref": "common.schema.json#/$defs/localDeclarationId" },
        "input": { "$ref": "common.schema.json#/$defs/localDeclarationId" },
        "output": { "$ref": "common.schema.json#/$defs/localDeclarationId" },
        "to": { "$ref": "common.schema.json#/$defs/localDeclarationId" }
      },
      "additionalProperties": false
    },
    "numericalKernelDeclaration": {
      "type": "object",
      "required": [
        "id", "kind", "operation", "mathematicalProposition", "inputEncoding",
        "finiteInputsOnly", "oracle", "oracleDecimalDigits", "metric", "maxUlps", "profile"
      ],
      "properties": {
        "id": { "$ref": "common.schema.json#/$defs/localDeclarationId" },
        "kind": { "const": "bounded-approximation-v1" },
        "operation": { "$ref": "common.schema.json#/$defs/localDeclarationId" },
        "mathematicalProposition": { "$ref": "common.schema.json#/$defs/nonEmptyString" },
        "inputEncoding": { "const": "binary64-hex-v1" },
        "finiteInputsOnly": { "const": true },
        "oracle": { "const": "exact-binary64-to-decimal-sqrt-v1" },
        "oracleDecimalDigits": { "type": "integer", "minimum": 1 },
        "metric": { "const": "binary64-ulp-distance-v1" },
        "maxUlps": { "type": "integer", "minimum": 0 },
        "profile": { "$ref": "common.schema.json#/$defs/realizationProfileReference" }
      },
      "additionalProperties": false
    },
    "resourceDeclaration": {
      "type": "object",
      "required": ["id", "rule"],
      "properties": {
        "id": { "$ref": "common.schema.json#/$defs/localDeclarationId" },
        "rule": { "$ref": "common.schema.json#/$defs/nonEmptyString" },
        "algebra": { "$ref": "#/$defs/finiteCommutativeMonoid" }
      },
      "additionalProperties": false
    },
    "finiteCommutativeMonoid": {
      "type": "object",
      "required": ["kind", "carrier", "unit", "composition", "bindings"],
      "properties": {
        "kind": { "const": "finite-commutative-monoid-v1" },
        "carrier": {
          "type": "array",
          "items": { "$ref": "common.schema.json#/$defs/localDeclarationId" },
          "minItems": 1,
          "uniqueItems": true
        },
        "unit": { "$ref": "common.schema.json#/$defs/localDeclarationId" },
        "composition": {
          "type": "array",
          "items": { "$ref": "#/$defs/resourceCompositionRow" },
          "minItems": 1
        },
        "bindings": {
          "type": "array",
          "items": { "$ref": "#/$defs/resourceAlgebraBinding" },
          "minItems": 1
        }
      },
      "additionalProperties": false
    },
    "resourceCompositionRow": {
      "type": "object",
      "required": ["left", "right", "result"],
      "properties": {
        "left": { "$ref": "common.schema.json#/$defs/localDeclarationId" },
        "right": { "$ref": "common.schema.json#/$defs/localDeclarationId" },
        "result": { "$ref": "common.schema.json#/$defs/localDeclarationId" }
      },
      "additionalProperties": false
    },
    "resourceAlgebraBinding": {
      "type": "object",
      "required": ["declarationReference", "element"],
      "properties": {
        "declarationReference": { "$ref": "common.schema.json#/$defs/declarationReference" },
        "element": { "$ref": "common.schema.json#/$defs/localDeclarationId" }
      },
      "additionalProperties": false
    },
    "performancePropositionDeclaration": {
      "type": "object",
      "required": [
        "id",
        "operationFamily",
        "workload",
        "costMeasure",
        "predicate",
        "permittedEvidenceMethods"
      ],
      "properties": {
        "id": { "$ref": "common.schema.json#/$defs/localDeclarationId" },
        "operationFamily": {
          "type": "array",
          "items": { "$ref": "common.schema.json#/$defs/localDeclarationId" },
          "minItems": 1,
          "uniqueItems": true
        },
        "workload": { "$ref": "common.schema.json#/$defs/profileMemberReference" },
        "costMeasure": { "$ref": "common.schema.json#/$defs/profileMemberReference" },
        "predicate": { "$ref": "common.schema.json#/$defs/nonEmptyString" },
        "permittedEvidenceMethods": {
          "$ref": "common.schema.json#/$defs/nonEmptyStringArray",
          "minItems": 1
        }
      },
      "additionalProperties": false
    },
    "effectContract": {
      "type": "object",
      "required": ["id", "default"],
      "properties": {
        "id": { "$ref": "common.schema.json#/$defs/localDeclarationId" },
        "forbidden": {
          "$ref": "common.schema.json#/$defs/nonEmptyStringArray"
        },
        "required": {
          "$ref": "common.schema.json#/$defs/nonEmptyStringArray"
        },
        "permitted": {
          "$ref": "common.schema.json#/$defs/nonEmptyStringArray"
        },
        "optional": {
          "$ref": "common.schema.json#/$defs/nonEmptyStringArray"
        },
        "default": { "$ref": "common.schema.json#/$defs/effectDisposition" }
      },
      "additionalProperties": false
    }
  }
}
