{"carriers":[{"description":"An abstract key domain governed by key-equivalence.","id":"Key"},{"description":"An abstract value domain governed by value-equivalence.","id":"Value"},{"description":"An abstract finite mapping from key-equivalence classes to values with stable first-insertion class order.","id":"OrderedMap"}],"effects":{"default":"unspecified","forbidden":["io.*"],"id":"ordered-map-effects","optional":["debug.emit"]},"equivalences":[{"carrier":"Key","definition":"A declared reflexive, symmetric, and transitive relation identifying live key classes; concrete representatives are unobserved.","id":"key-equivalence"},{"carrier":"Value","definition":"A declared reflexive, symmetric, and transitive relation used to compare lookup and entry values.","id":"value-equivalence"},{"carrier":"OrderedMap","definition":"Pointwise equality of entries class/value sequences under key-equivalence and value-equivalence.","id":"ordered-map-equivalence"}],"id":"ordered-map","kind":"specification","laws":[{"id":"lookup-empty","statement":"lookup(empty, k) == None"},{"id":"lookup-put-same","statement":"lookup(put(m, k, v), k) is value-equivalent to v"},{"id":"lookup-put-other","statement":"if k1 is not key-equivalent to k2, lookup(put(m, k1, v), k2) == lookup(m, k2) under value-equivalence"},{"id":"put-existing-position","statement":"put with a key equivalent to a live class preserves that class position and replaces its associated value; concrete key representative retention or replacement is unobserved"},{"id":"put-new-appends","statement":"put with a key inequivalent to every live key class appends exactly one class/value entry"},{"id":"size-put","statement":"size(put(m, k, v)) == size(m) when k is key-equivalent to a live class, and size(put(m, k, v)) == size(m) + 1 otherwise"}],"observations":[{"id":"lookup","signature":"OrderedMap[Key,Value] * Key -> Option[Value]"},{"id":"entries","signature":"OrderedMap[Key,Value] -> Sequence[KeyClass * Value]"},{"id":"size","signature":"OrderedMap[Key,Value] -> Natural"}],"operations":[{"id":"empty","signature":"OrderedMap[Key,Value]"},{"id":"put","signature":"OrderedMap[Key,Value] * Key * Value -> OrderedMap[Key,Value]"}],"performancePropositions":[{"costMeasure":{"localId":"realization-steps","profile":{"id":"ordered-map-ascii-fold","kind":"realizationProfile","version":"0.1.0"}},"id":"put-amortized-constant","operationFamily":["put"],"permittedEvidenceMethods":["proof","proof-audit"],"predicate":"There exist constants a,b >= 0 such that for every n >= 0 and every permitted length-n key/value sequence, total realization-steps is at most a*n+b.","workload":{"localId":"put-sequence","profile":{"id":"ordered-map-ascii-fold","kind":"realizationProfile","version":"0.1.0"}}}],"resources":[{"id":"persistence","rule":"Retained map handles remain usable and observationally unchanged after put on them or derived handles."}],"version":"0.2.0"}
